{
  "artifact": "ResearchReport",
  "run_id": "2026-10-23-agent-framework-adoption",
  "query": "Which open-source agent frameworks gained the most production adoption this year, and what do independent (non-vendor) sources say about where each breaks down at scale?",
  "executive_summary": "Through October 2026, production adoption of open-source agent frameworks has concentrated in a short head. LangChain and its runtime LangGraph dominate measured usage — 170.5M and 44.8M monthly PyPI downloads respectively, with the only widely echoed named enterprise deployment at scale (Klarna's assistant, vendor-asserted). The steepest 2025-26 gains came from a zero base: OpenAI Agents SDK (12.4M downloads/month, 30.2K stars in ~19 months) and Google ADK (10.1M/month, 22.0K stars in ~19 months). GitHub stars tell a different story — AutoGen (61.5K) and CrewAI (60.0K) lead while sitting at 0.8M and 2.4M monthly downloads — so 'most adopted' depends on whether usage or mindshare is meant. On where frameworks break down at scale, the independent accounts converge on durability: every top-5 framework saves state but leaves failure detection, automatic recovery, and duplicate prevention to the operator, with framework-specific failure patterns recorded for LangGraph, CrewAI, Microsoft Agent Framework, and the OpenAI SDK.",
  "key_findings": [
    {
      "finding": "LangChain and LangGraph lead measured usage by an order of magnitude: 170.5M and 44.8M monthly PyPI downloads (re-verified against the registry API).",
      "evidence_ids": [
        "E7",
        "E8"
      ]
    },
    {
      "finding": "GitHub stars rank the field differently: AutoGen (61.5K) and CrewAI (60.0K) lead, while LangGraph (43.8K) — with ~18× CrewAI's monthly downloads — sits below both.",
      "evidence_ids": [
        "E2",
        "E8",
        "E9",
        "E10"
      ]
    },
    {
      "finding": "OpenAI Agents SDK shows the fastest raw growth in the candidate set: 30.2K stars and 12.4M monthly downloads within ~19 months of creation (2025-03-11).",
      "evidence_ids": [
        "E11",
        "E3"
      ]
    },
    {
      "finding": "Google ADK shows a near-identical trajectory: 22.0K stars and 10.1M monthly downloads within ~19 months (2025-04-01).",
      "evidence_ids": [
        "E12"
      ]
    },
    {
      "finding": "Microsoft retired AutoGen into maintenance mode; Agent Framework is now its sole agent framework.",
      "evidence_ids": [
        "E6",
        "E10"
      ]
    },
    {
      "finding": "The common independent critique at scale is durability: LangGraph, CrewAI, and Google ADK checkpoint state but leave failure detection, automatic recovery, and duplicate prevention to the operator; Microsoft Agent Framework's resume is entirely manual with no watchdog.",
      "evidence_ids": [
        "E22",
        "E23"
      ]
    },
    {
      "finding": "LangGraph's documented production failure patterns include unbounded checkpoint state, recursion-limit terminations, silent last-write-wins state loss, checkpointer connection exhaustion, and unresumable interrupt state after restart.",
      "evidence_ids": [
        "E18"
      ]
    },
    {
      "finding": "CrewAI's documented production failure modes include silent context truncation in handoffs, hierarchical stalls, unbroken tool loops, and cost multiplication; a practitioner account adds opaque hierarchical routing, and the vendor itself calls trust the top barrier to production.",
      "evidence_ids": [
        "E19",
        "E20",
        "E21",
        "E16"
      ]
    },
    {
      "finding": "The OpenAI Agents SDK in production requires an external runtime for durable execution and carries a model lock-in surface around the OpenAI APIs.",
      "evidence_ids": [
        "E24",
        "E25"
      ]
    },
    {
      "finding": "Google ADK's 1.0 release shipped breaking changes while presented as production-ready — confirmed by the official release notes' '⚠ BREAKING CHANGES' and upgrade-failure issues #808/#970/#978 — and Google's own docs record ~4.7s cold-start latency at min_instances=1.",
      "evidence_ids": [
        "E26",
        "E27"
      ]
    },
    {
      "finding": "Named production use is strongest for LangGraph (Klarna at 85M users; LinkedIn, Uber) but rests on vendor-asserted claims; third-party echoes trace to the same vendor-origin story.",
      "evidence_ids": [
        "E15"
      ]
    }
  ],
  "detailed_analysis": [
    {
      "question_id": "RQ1",
      "analysis": "The candidate set is not contested: four independent sources (a tracker maintaining its own dataset, a practitioner comparison with growth data, a survey-citing vendor-neutral comparison, and tech press) cross-name the same short head — LangChain/LangGraph, CrewAI, AutoGen (now Microsoft Agent Framework), OpenAI Agents SDK, Google ADK, Pydantic AI, LlamaIndex, Smolagents, Mastra. As established under V6, AutoGen is a special case: it remains the stars leader (61.5K) but is officially in maintenance mode, so its momentum belongs to Microsoft Agent Framework going forward. Two boundaries were enforced rather than assumed: Mastra was excluded because its hybrid LICENSE.md (with restricted ee/ portions) does not map to a recognized single OSS license (V17), and visual builders (Dify, n8n) plus the unclassifiable OpenClaw were kept outside the code-framework ranking. The result is a defensible candidate set of seven code frameworks, of which five carry enough signal mass for ranking."
    },
    {
      "question_id": "RQ2",
      "analysis": "Primary signals — re-verified by direct API re-runs (V1) — split into two families that must not be conflated (as the tracker itself warns, E17/V18). Usage signals: LangChain 170.5M and LangGraph 44.8M monthly downloads dwarf everything else; the two youngest frameworks, OpenAI Agents SDK (12.4M) and Google ADK (10.1M), already outrank every incumbent except the LangChain stack. Mindshare signals: AutoGen and CrewAI lead stars at ~60-61K, with CrewAI showing the largest 6-month gain among incumbents (+2,540, E3). Contributor counts cluster tightly (285-475), meaning no framework has a moat of unique maintainers. Named production use is the weakest signal family: Klarna/LinkedIn/Uber for LangGraph are vendor-asserted (V8 — third-party echoes trace to the vendor's own story), HatchWorks names live ADK client work (E28), deepsense.ai names enterprise early-access testing of the Agents API (E29), and CrewAI's '2 billion workflows' is an unaudited vendor metric (V15). Coverage of the plan's success criteria is complete for all five shortlisted frameworks except that CrewAI's strongest production evidence is the vendor's own."
    },
    {
      "question_id": "RQ3",
      "analysis": "Ranking by 'gained the most production adoption this year' produces two defensible answers, and the disagreement between them is itself a finding (V18). On measured usage gains, OpenAI Agents SDK and Google ADK gained the most — both went from nonexistent to top-4 monthly downloads in ~19 months (E11, E12), trajectories corroborated by independent 6-month star deltas (E3). On absolute installed base, LangChain/LangGraph lead and LangGraph is the only framework with a named at-scale enterprise deployment echoed by third parties (E15, with the vendor-origin caveat). The stars ranking — AutoGen and CrewAI on top — measures community attention, not deployment, and inverts the usage order precisely for the frameworks with the weakest download numbers (AutoGen 0.79M/month while in maintenance). No independent source publishes a combined trailing-12-months growth ranking (bundle gap), so the composite ranking in this report is constructed from primary signals; the construction rule, not any single number, is what a reader should audit."
    },
    {
      "question_id": "RQ4",
      "analysis": "Independent accounts of where each top-5 framework breaks down at scale converge on one structural point before any framework-specific one: checkpointing is not durable execution. Diagrid's source-inspected analysis (V11) finds that LangGraph, CrewAI, and Google ADK save state but leave failure detection, automatic recovery, and duplicate prevention to the operator, and that Microsoft Agent Framework's resume is entirely manual — no supervisor, scheduler, heartbeat, lease, or watchdog. Framework-specific patterns then diverge. LangGraph's failures are state-centric: unbounded checkpoints exhausting memory, recursion limits terminating mid-task, last-write-wins losses on concurrent branches, and interrupt state that cannot resume after a deploy restart (E18, corroborated by a 50-agent rollout describing ops pain rather than graph-logic pain, E30/V16). CrewAI's failures are composition-centric: silent context truncation between agents, hierarchical routing that cannot be unit-tested, unbroken tool loops, and cost multiplication as crews grow (E19, E20, E21) — with the vendor itself conceding trust is the top production barrier (E16). The OpenAI SDK's gap is runtime-shaped: teams wrap it in FastAPI/Kubernetes and still lack durable execution (E24), plus a model lock-in surface (E25). Google ADK's documented problems are release-hygiene and platform-shaped: 1.0 shipped breaking changes under a production-ready banner — confirmed by the official release notes and upgrade-failure issues (V13) — and its managed runtime adds ~4.7s cold starts at low min_instances (E27, official, contextual). Notably, every one of these accounts comes from parties without a stake in the framework being critiqued; where the critic has commercial interest (Diagrid, ZenML), it is disclosed on the record and the direction is corroborated by a second source."
    },
    {
      "question_id": "RQ5",